{
  "$schema": "http://json-schema.org/draft-07/schema#",
  "$id": "https://anvil.dev/config.schema.json",
  "title": "Anvil Launcher Config",
  "description": "Configuration file for an Anvil Minecraft launcher (config.json)",
  "type": "object",
  "anyOf": [{ "required": ["instances"] }, { "required": ["anvil-server"] }],
  "allOf": [
    {
      "if": {
        "properties": { "session": { "const": "microsoft" } },
        "required": ["session"]
      },
      "then": {
        "required": ["microsoft-client-id"],
        "properties": { "microsoft-client-id": { "minLength": 1 } }
      }
    }
  ],
  "additionalProperties": false,
  "properties": {
    "$schema": {
      "type": "string",
      "description": "JSON schema URL for validation",
      "default": "./node_modules/@thomasfarineau/anvil/src/client/config.schema.json"
    },
    "identifier": {
      "type": "string",
      "description": "Reverse-domain app identifier (e.g. com.mycompany.mylauncher). Used by Tauri to name the installed bundle.",
      "default": ""
    },
    "target": {
      "type": "string",
      "description": "Output directory for compiled executables/installers (relative to project root). Defaults to src-anvil/target/ when empty.",
      "default": ""
    },
    "app_name": {
      "type": "string",
      "description": "Native window title",
      "default": "HomeLauncher"
    },
    "data_folder": {
      "type": "string",
      "description": "Subfolder name inside %APPDATA% / ~/Library used to store game files",
      "default": "HomeLauncher"
    },
    "java_version": {
      "type": "integer",
      "enum": [17, 21],
      "description": "Java version to download and use",
      "default": 21
    },
    "update_url": {
      "type": "string",
      "description": "URL of the update manifest (leave empty to disable auto-update)"
    },
    "logo": {
      "type": "string",
      "description": "Path (relative to src/) or URL of the branding logo displayed in the UI"
    },
    "session": {
      "type": "string",
      "enum": ["none", "microsoft", "custom", "anvil-session"],
      "description": "Authentication mode. 'none': offline. 'microsoft': Microsoft/Xbox/Minecraft Java device-code login. 'custom': client calls MC.setSession() before launch. 'anvil-session': login (username/password/2FA) handled by the anvil-server declared in 'anvil-server'.",
      "default": "none"
    },
    "microsoft-client-id": {
      "type": "string",
      "description": "Microsoft Entra application (client) ID used by the 'microsoft' session. Register a public client application supporting personal Microsoft accounts and device-code flow.",
      "default": ""
    },
    "anvil-server": {
      "type": "string",
      "description": "Base URL of an anvil-server instance (e.g. https://mods.example.com). When set, the launcher fetches the list of enabled instances from this server at startup (the 'instances' field becomes unnecessary), and 'anvil-session' authentication is validated against it.",
      "default": ""
    },
    "anvil-key": {
      "type": "string",
      "description": "API key generated in the anvil-server web UI (Clés API). Required to query the server: instance list, sessions and file downloads are refused without a valid key.",
      "default": ""
    },
    "window": {
      "type": "object",
      "description": "Native launcher window settings",
      "additionalProperties": false,
      "properties": {
        "decorations": { "type": "boolean", "description": "Show native window title bar and borders", "default": true },
        "resizable": { "type": "boolean", "description": "Allow the user to resize the launcher window", "default": true },
        "width": { "type": "integer", "minimum": 800, "description": "Initial launcher window width in logical pixels", "default": 1000 },
        "height": { "type": "integer", "minimum": 520, "description": "Initial launcher window height in logical pixels", "default": 660 },
        "shadow": { "type": "boolean", "description": "Show the native window shadow", "default": true },
        "transparent": { "type": "boolean", "description": "Use a transparent native window background", "default": false },
        "devtools": { "type": "boolean", "description": "Enable or disable webview developer tools in development mode", "default": true }
      },
      "default": {}
    },
    "instances": {
      "type": "array",
      "description": "List of Minecraft instances available in the launcher. Ignored (replaced) when 'anvil-server' is set: the server's enabled instances are used instead.",
      "minItems": 1,
      "items": {
        "type": "object",
        "required": ["id"],
        "additionalProperties": false,
        "properties": {
          "id": {
            "type": "string",
            "description": "Unique identifier for this instance (used as folder name)"
          },
          "name": {
            "type": "string",
            "description": "Display name shown on the play button"
          },
          "mc_version": {
            "type": "string",
            "description": "Minecraft version (e.g. \"1.21.4\")"
          },
          "loader": {
            "type": "string",
            "enum": ["", "fabric", "forge", "neoforge", "quilt"],
            "description": "Mod loader to install alongside Minecraft",
            "default": ""
          },
          "loader_version": {
            "type": "string",
            "description": "Mod loader version (e.g. \"0.16.9\" for Fabric)",
            "default": ""
          },
          "server_ip": {
            "type": "string",
            "description": "Server IP to auto-connect to on launch",
            "default": ""
          },
          "server_port": {
            "type": "integer",
            "minimum": 1,
            "maximum": 65535,
            "description": "Server port",
            "default": 25565
          },
          "mods": {
            "type": "array",
            "description": "Mods downloaded into this instance's mods/ folder during setup",
            "items": {
              "type": "object",
              "required": ["url"],
              "additionalProperties": false,
              "properties": {
                "name": {
                  "type": "string",
                  "description": "Display name of the mod"
                },
                "url": {
                  "type": "string",
                  "description": "Direct download URL of the mod .jar"
                },
                "file_name": {
                  "type": "string",
                  "description": "Target file name in mods/ (defaults to the URL basename)"
                }
              }
            }
          },
          "files": {
            "type": "array",
            "description": "Extra files (mod configs, options.txt…) downloaded into the instance folder during setup. Always overwritten: the source (usually an anvil-server) is authoritative.",
            "items": {
              "type": "object",
              "required": ["path", "url"],
              "additionalProperties": false,
              "properties": {
                "path": {
                  "type": "string",
                  "description": "Relative target path inside the instance folder (e.g. \"config/mymod.toml\")"
                },
                "url": {
                  "type": "string",
                  "description": "Direct download URL of the file"
                }
              }
            }
          }
        }
      }
    }
  }
}
