{
  "$schema": "./node_modules/@thomasfarineau/anvil/src/client/config.schema.json",
  "identifier": "com.example.anvil.example",
  "target": "./dist",
  "app_name": "Anvil Launcher Example",
  "data_folder": ".anvilLauncher",
  "java_version": 21,
  "update_url": "",
  "logo": "./logo.svg",
  "session": "custom",
  "window": {
    "decorations": true,
    "resizable": false,
    "width": 1000,
    "height": 660,
    "shadow": true,
    "transparent": false,
    "devtools": true
  },
  "instances": [
    {
      "id": "vanilla",
      "name": "Survie 1.21.8",
      "mc_version": "1.21.8"
    }
  ]
}
