{
  "$schema": "node_modules/@thomasfarineau/anvil/src/client/config.schema.json",
  "identifier": "",
  "target": "",
  "app_name": "My Launcher",
  "data_folder": ".my-launcher",
  "java_version": 21,
  "update_url": "",
  "logo": "logo.svg",
  "session": "none",
  "microsoft-client-id": "",
  "window": {
    "decorations": true,
    "resizable": true,
    "width": 1000,
    "height": 660,
    "shadow": true,
    "transparent": false,
    "devtools": true
  },
  "instances": [
    {
      "id": "survival",
      "name": "Survival",
      "mc_version": "1.21.4"
    }
  ]
}
